{"artifact_kind":"pooleos_native_symbol_golden_vectors","claim_boundary":["Golden vectors are finite synthetic parser evidence.","The canonical vector binds one development kernel build and is unsigned.","Vector success does not enable target consumption or production promotion."],"contract_id":"PSYM1","production_ready":false,"schema_version":"1.0","status":"synthetic_non_promoting_golden_bytes","vectors":[{"bundle_byte_count":725,"bundle_hex":"5053594D31000000010000008001200030000000FF7F000001000100010001000400000003000000D5020000000000008001000000000000000200000000000090020000000000004500000000000000003009000000000000000080FFFFFFFF000000C0FFFFFFFF000020000000000000A000000000000010000000001000007F0000000D0000000100010001000000A943DCB6E41A27F952868F05ED2B3523B47D9D7A7B5DB909EE385205F7CA3B31F4698CB6E7DE51E07041410A274E3BE08886D09F51E681290E743E1361858FFCA3AA898B88418157A5F852C2BF88CA2F5B41011A114B0D08171B6E8EDFD5A1F6557687A9F39EEECFFD839A8619D696CEBB4E391B229778162725752C72B4D9AA72A05420D51D580789C52038A87E1B82AFD662A1EF962403F39DE58AC573AC1160CE4B43F47AF9C2E42C19734A5A016FD747BB84E70AD7159DC7E6190E50470F0000000000000000000000000000000000000000000000000000000000000000000000000000000000000000000000000100010001000000000000000000000000A00000000000000000000000000000020002000500000000A0000000000000009006000000000000000000000000000300030009000000003007000000000000E000000000000000000000000000000400040003000000001008000000000000200100000000000000000000000000010000000200010100010B0000000000120000007DC1336B00A000000000000047000000000000000000000000000000020000000200010100010D00120000001C00000096551D458AA6020000000000C60000000000000000000000000000000300000002000101000109002E000000170000002E82FD8050A7020000000000F4140100000000000000000000000000706F6F6C655F6B65726E656C5F656E747279706F6F6C655F6B65726E656C5F656D657267656E63795F70616E6963706F6F6C655F6B65726E656C5F727573745F656E747279","bundle_sha256":"7606A097BF9F4DC5D89E5C18C2D821B8BAFF4D9F45540A5B3ECE20094940792B","id":"PSYM1-CANONICAL","lookup_samples":[{"result":"unknown","runtime_address":18446744071562108927,"runtime_base":18446744071562067968},{"result":"poole_kernel_entry+0x0","runtime_address":18446744071562108928,"runtime_base":18446744071562067968},{"result":"poole_kernel_entry+0x46","runtime_address":18446744071562108998,"runtime_base":18446744071562067968},{"result":"unknown","runtime_address":18446744071562108999,"runtime_base":18446744071562067968},{"result":"unknown","runtime_address":18446744071562216999,"runtime_base":18446744071562067968},{"result":"unknown","runtime_address":18446744071562217000,"runtime_base":18446744071562067968},{"result":"unknown","runtime_address":18446744071562217197,"runtime_base":18446744071562067968},{"result":"unknown","runtime_address":18446744071562217198,"runtime_base":18446744071562067968},{"result":"poole_kernel_rust_entry+0x840F","runtime_address":18446744071562275679,"runtime_base":18446744071562067968},{"result":"poole_kernel_rust_entry+0x8410","runtime_address":18446744071562275680,"runtime_base":18446744071562067968}],"purpose":"real PooleKernel public diagnostic profile","summary":{"body_sha256":"60CE4B43F47AF9C2E42C19734A5A016FD747BB84E70AD7159DC7E6190E50470F","build_id_sha256":"A3AA898B88418157A5F852C2BF88CA2F5B41011A114B0D08171B6E8EDFD5A1F6","bundle_bytes":725,"canonical_file_sha256":"A943DCB6E41A27F952868F05ED2B3523B47D9D7A7B5DB909EE385205F7CA3B31","contract_id":"PSYM1","debug_file_sha256":"557687A9F39EEECFFD839A8619D696CEBB4E391B229778162725752C72B4D9AA","entry_offset":40960,"image_bytes":602112,"preferred_loaded_sha256":"F4698CB6E7DE51E07041410A274E3BE08886D09F51E681290E743E1361858FFC","preferred_virtual_base":18446744071562067968,"segment_count":4,"slide_alignment":2097152,"source_manifest_sha256":"72A05420D51D580789C52038A87E1B82AFD662A1EF962403F39DE58AC573AC11","string_bytes":69,"symbol_count":3,"version":"1.0","virtual_window_end_exclusive":18446744072635809792}},{"bundle_byte_count":482,"bundle_hex":"5053594D31000000010000008001200030000000FF7F000001000100010001000100000001000000E2010000000000008001000000000000A001000000000000D0010000000000001200000000000000001000000000000000000080FFFFFFFF000000C0FFFFFFFF0000200000000000000000000000000010000000001000007F0000000D00000001000100010000004759F30884B44A5432D4B3723B2C12956615A400470EB7FB3E9F4DF87888B1406669A6262F07E00C5B8BE35F0C95FCA21043BDEF8629EB89E3F33E61708126C92C5FC96D134B289B4141A5FFE52DA8DBDD514F9629C54C13D3BC7EAD580A7D10C524F63A071C0530E18068992B7C60DA859D0B0521E38F518172F199A34CC5D7766DC10B87DA542B90BF87D7795E2EA5A30DBFBE0F09FF44CEB4BC034FC9FD85F756F4ECC8F187ED368B7533E3463471C74AF6C53427D4B52249A2890B7374C20000000000000000000000000000000000000000000000000000000000000000000000000000000000000000000000000100020005000000000000000000000000100000000000000000000000000000010000000100010100010B0000000000120000007DC1336B000000000000000040000000000000000000000000000000706F6F6C655F6B65726E656C5F656E747279","bundle_sha256":"B20D36D885E9BADDFE6296F5CEF73A9B01D8262250085CB0A4A346F8930791FD","id":"PSYM1-MINIMAL","lookup_samples":[{"result":"poole_kernel_entry+0x0","runtime_address":18446744071562067968,"runtime_base":18446744071562067968},{"result":"poole_kernel_entry+0x3F","runtime_address":18446744071562068031,"runtime_base":18446744071562067968},{"result":"unknown","runtime_address":18446744071562068032,"runtime_base":18446744071562067968},{"result":"unknown","runtime_address":18446744071562072063,"runtime_base":18446744071562067968}],"purpose":"minimum valid single-segment profile","summary":{"body_sha256":"F756F4ECC8F187ED368B7533E3463471C74AF6C53427D4B52249A2890B7374C2","build_id_sha256":"2C5FC96D134B289B4141A5FFE52DA8DBDD514F9629C54C13D3BC7EAD580A7D10","bundle_bytes":482,"canonical_file_sha256":"4759F30884B44A5432D4B3723B2C12956615A400470EB7FB3E9F4DF87888B140","contract_id":"PSYM1","debug_file_sha256":"C524F63A071C0530E18068992B7C60DA859D0B0521E38F518172F199A34CC5D7","entry_offset":0,"image_bytes":4096,"preferred_loaded_sha256":"6669A6262F07E00C5B8BE35F0C95FCA21043BDEF8629EB89E3F33E61708126C9","preferred_virtual_base":18446744071562067968,"segment_count":1,"slide_alignment":2097152,"source_manifest_sha256":"766DC10B87DA542B90BF87D7795E2EA5A30DBFBE0F09FF44CEB4BC034FC9FD85","string_bytes":18,"symbol_count":1,"version":"1.0","virtual_window_end_exclusive":18446744072635809792}},{"bundle_byte_count":755,"bundle_hex":"5053594D31000000010000008001200030000000FF7F000001000100010001000200000003000000F3020000000000008001000000000000C0010000000000005002000000000000A300000000000000003000000000000000000080FFFFFFFF000000C0FFFFFFFF0000200000000000000000000000000010000000001000007F0000000D0000000100010001000000E2CA1290A34E3C1EEC0FDECE37AFC0536879BC4E402AE9BBFAB86CAA10955390C8CE228D2C8429A68005214EFEB7CB0E2FFCB17DA9E800F5AE331EB93EEB9654FB09F15CB0A1F7A0307D4D2210A3C6223F94D8CEC0A315D1711E518BE884F3C90EFF5B5C98F1547F95EBBC6DDD5CE2BBA58E7225BF047571E65996BF811D8CF3BA5CD303D7002401669450812F46BBD3240D732EE1BD4399085B019D92336D4272C85CCD2AB9D99E184CCB6876EED34BBD28FCCAD6D9916CDEEE697B4123DE8700000000000000000000000000000000000000000000000000000000000000000000000000000000000000000000000001000200050000000000000000000000002000000000000000000000000000000200040003000000002000000000000000100000000000000000000000000000010000000100010100010B0000000000120000007DC1336B000000000000000020000000000000000000000000000000020000000100010100010900120000007F000000B4D1515100100000000000008000000000000000000000000000000003000000020002010001080091000000120000007BE12D9B002000000000000040000000000000000000000000000000706F6F6C655F6B65726E656C5F656E74727950414141414141414141414141414141414141414141414141414141414141414141414141414141414141414141414141414141414141414141414141414141414141414141414141414141414141414141414141414141414141414141414141414141414141414141414141414141414141414141414141414141414141504F4F4C455F5055424C49435F5354415445","bundle_sha256":"C8F663B810AF29941A99228FB09F6DFEF6D8A54072973367AC477886CA027FB5","id":"PSYM1-BOUNDARY","lookup_samples":[{"result":"poole_kernel_entry+0x0","runtime_address":18446744071562067968,"runtime_base":18446744071562067968},{"result":"poole_kernel_entry+0x1F","runtime_address":18446744071562067999,"runtime_base":18446744071562067968},{"result":"unknown","runtime_address":18446744071562068000,"runtime_base":18446744071562067968},{"result":"PAAAAAAAAAAAAAAAAAAAAAAAAAAAAAAAAAAAAAAAAAAAAAAAAAAAAAAAAAAAAAAAAAAAAAAAAAAAAAAAAAAAAAAAAAAAAAAAAAAAAAAAAAAAAAAAAAAAAAAAAAAAAAA+0x0","runtime_address":18446744071562072064,"runtime_base":18446744071562067968},{"result":"PAAAAAAAAAAAAAAAAAAAAAAAAAAAAAAAAAAAAAAAAAAAAAAAAAAAAAAAAAAAAAAAAAAAAAAAAAAAAAAAAAAAAAAAAAAAAAAAAAAAAAAAAAAAAAAAAAAAAAAAAAAAAAA+0x7F","runtime_address":18446744071562072191,"runtime_base":18446744071562067968},{"result":"POOLE_PUBLIC_STATE+0x0","runtime_address":18446744071562076160,"runtime_base":18446744071562067968},{"result":"POOLE_PUBLIC_STATE+0x3F","runtime_address":18446744071562076223,"runtime_base":18446744071562067968}],"purpose":"maximum-name and mixed-permission boundary profile","summary":{"body_sha256":"72C85CCD2AB9D99E184CCB6876EED34BBD28FCCAD6D9916CDEEE697B4123DE87","build_id_sha256":"FB09F15CB0A1F7A0307D4D2210A3C6223F94D8CEC0A315D1711E518BE884F3C9","bundle_bytes":755,"canonical_file_sha256":"E2CA1290A34E3C1EEC0FDECE37AFC0536879BC4E402AE9BBFAB86CAA10955390","contract_id":"PSYM1","debug_file_sha256":"0EFF5B5C98F1547F95EBBC6DDD5CE2BBA58E7225BF047571E65996BF811D8CF3","entry_offset":0,"image_bytes":12288,"preferred_loaded_sha256":"C8CE228D2C8429A68005214EFEB7CB0E2FFCB17DA9E800F5AE331EB93EEB9654","preferred_virtual_base":18446744071562067968,"segment_count":2,"slide_alignment":2097152,"source_manifest_sha256":"BA5CD303D7002401669450812F46BBD3240D732EE1BD4399085B019D92336D42","string_bytes":163,"symbol_count":3,"version":"1.0","virtual_window_end_exclusive":18446744072635809792}}]}
